<?xml version="1.0"?>
<!DOCTYPE qualm-data PUBLIC "-//QUALM/DTD Qualm Data//EN" "http://qualm.berlios.de/qualm.dtd">

<qualm-data>
  <title>QDL-1</title>
  <midi-channels>
    <channel num="1">Lower Kbd</channel>
    <channel num="2">Upper Kbd</channel>
    <channel num="10">Drums</channel>
  </midi-channels>
  <patches>
    <patch id="P1" bank="User" num="1">Patch 1</patch>
    <patch id="P2" bank="PrA" num="2" volume="20">Patch 2</patch>
    <patch id="P3" bank="XpA" num="3" volume="80%">Patch 3</patch>
    <patch id="Timpani" bank="PrA" num="5"/>
    <patch-alias id="P3_2" target="P3" volume="100%">Patch 3 Alias</patch-alias>
  </patches>

  <cue-stream id="First_Stream">
    <global>
      <trigger><note-on channel="1" note="c6"/></trigger>
      <trigger reverse="yes"><note-on channel="1" note="c2"/></trigger>
      <map-events>
	<map-from><control-change channel="1" control="damper"/></map-from>
	<map-to><control-change channel="2" control="80"/></map-to>
      </map-events>
    </global>
    <cue song="3" measure="1">
      <events><program-change channel="1" patch="P1"/></events>
      <trigger delay="2.5"><note-on channel="2" note="g2"/></trigger>
    </cue>
    <cue song="3" measure="16">
      <events>
	<program-change channel="10" patch="Timpani"/>
	<program-change channel="1" patch="P3"/>
      </events>
    </cue>
  </cue-stream>
  <cue-stream id="Second_Stream">
    <global>
      <trigger><note-on channel="2" note="c6"/></trigger>
    </global>
    <cue song="1" measure="1">
      <events><program-change channel="2" patch="P2"/></events>
    </cue>
    <cue song="2" measure="10">
      <events>
	<program-change channel="2" patch="P3_2"/>
	<advance stream="First_Stream"/>
      </events>
    </cue>
  </cue-stream>
</qualm-data>
